<?xml version="1.0" encoding="UTF-8"?>
<!--Sample XML file generated by XMLSpy v2006 rel. 3 sp1 (http://www.altova.com)-->
<openDaApplication xmlns:xsi="http://www.w3.org/2001/XMLSchema-instance" xsi:noNamespaceSchemaLocation="..\..\..\..\..\openda\xmlSchemas\openDaApplication.xsd">
	<stochObserver className="org.costa.CtaStochObserver">
		<workingDirectory>.</workingDirectory>
		<configFile>obs2sds_d97.sql</configFile>
	</stochObserver>
	<stochModelFactory className="org.costa.CtaStochModelFactory">
		<workingDirectory>.</workingDirectory>
                <configString>modelClass="waqua_class.xml";model="waqua.xml"</configString>
	</stochModelFactory>
	<algorithm className="org.openda.algorithms.kalmanFilter.EnKF">
		<workingDirectory>.</workingDirectory>
                <configString>EnkfConfig.xml</configString>
	</algorithm>
	<resultWriter className="org.openda.utils.AsciiResultWriter">
		<workingDirectory>.</workingDirectory>
                <configFile>EnKF-results.txt</configFile>
	</resultWriter>
</openDaApplication>
