<?xml version="1.0" encoding="UTF-8"?>
<openDaApplication xmlns="http://www.openda.org" xmlns:xsi="http://www.w3.org/2001/XMLSchema-instance" xsi:schemaLocation="http://www.openda.org http://schemas.openda.org/openDaApplication.xsd">
	<stochObserver
className="org.openda.observers.NoosTimeSeriesStochObserver">
		<workingDirectory>.</workingDirectory>
		<configFile>noos_obs_oscill.xml</configFile>
	</stochObserver>
	<stochModelFactory className="org.openda.costa.CtaStochModelFactory">
		<workingDirectory>.</workingDirectory>
		<configString>modelClass="oscill_sp_class.xml";model="oscill_sp.xml"</configString>
	</stochModelFactory>
	<algorithm className="org.openda.algorithms.kalmanFilter.EnKF">
		<workingDirectory>.</workingDirectory>
		<configString></configString>
	</algorithm>
	<resultWriter className="org.openda.utils.AsciiResultWriter">
		<workingDirectory>.</workingDirectory>
		<configFile>EnKF-results.txt</configFile>
	</resultWriter>
</openDaApplication>
