<?xml version="1.0" encoding="UTF-8"?>
<openDaApplication xmlns="http://www.openda.org" xmlns:xsi="http://www.w3.org/2001/XMLSchema-instance" xsi:schemaLocation="http://www.openda.org http://schemas.openda.org/openDaApplication.xsd">
	<stochObserver className="nl.wldelft.openda.observers.DaStochObserver">
		<workingDirectory>../stochobserver</workingDirectory>
		<configFile>swanStochObsConfig_3var.xml</configFile>
	</stochObserver>
	<stochModelFactory className="nl.wldelft.openda.models.DaModelFactory">
		<workingDirectory>../swanModel/config</workingDirectory>
		<configFile>openDaStochModel.xml</configFile>
	</stochModelFactory>
	<algorithm className="org.openda.algorithms.Dud">
		<workingDirectory>../algorithm</workingDirectory>
		<configString></configString>
	</algorithm>
	<resultWriter className="org.openda.resultwriters.MatlabResultWriter">
		<workingDirectory>.</workingDirectory>
		<configFile>dud_matlab_results_3var.m</configFile>
	</resultWriter>
</openDaApplication>
