<?xml version="1.0" encoding="UTF-8"?>
<openDaApplication xmlns="http://www.openda.org" xmlns:xsi="http://www.w3.org/2001/XMLSchema-instance" xsi:schemaLocation="http://www.openda.org http://schemas.openda.org/openDaApplication.xsd">
	<stochObserver className="org.openda.costa.CtaStochObserver">
		<workingDirectory>.</workingDirectory>
		<configFile>obs_oscill.sql</configFile>
	</stochObserver>
	<stochModelFactory className="org.openda.costa.CtaStochModelFactory">
		<workingDirectory>.</workingDirectory>
		<configString>modelClass="oscill_sp_class.xml";model="oscill_sp.xml"</configString>
	</stochModelFactory>
	<algorithm className="org.openda.algorithms.kalmanFilter.EnKF">
		<workingDirectory>.</workingDirectory>
		<configString>ensconfig.xml</configString>
	</algorithm>
        <timingSettings doTiming="true"></timingSettings>
        <resultWriter className="org.openda.resultwriters.MatlabResultWriter">
		<workingDirectory>.</workingDirectory>
		<configFile>EnKF-results.m</configFile>
	</resultWriter>
</openDaApplication>
