<?xml version="1.0" encoding="UTF-8"?>
<openDaApplication xmlns="http://www.openda.org" xmlns:xsi="http://www.w3.org/2001/XMLSchema-instance" xsi:schemaLocation="http://www.openda.org http://schemas.openda.org/openDaApplication.xsd">
	<stochObserver className="org.openda.observers.CsvStochObserver">
		<workingDirectory>./stochobserver</workingDirectory>
		<!-- <configFile>OscillatorSimpleStochObsConfig.xml</configFile> -->
		<configFile>observations_oscillator_generated.csv</configFile>
	</stochObserver>
	<stochModelFactory className="org.openda.models.oscillator.OscillatorStochModelFactory">
		<workingDirectory>./model</workingDirectory>
		<configFile>OscillatorStochModel.xml</configFile>
	</stochModelFactory>
	<algorithm className="org.openda.algorithms.kalmanFilter.EnSR">
		<workingDirectory>./algorithm</workingDirectory>
		<configString>EnsrAlgorithm.xml</configString>
	</algorithm>
	<resultWriters>
		<!-- <resultWriter className="org.openda.resultwriters.MatlabResultWriter">
			<workingDirectory>.</workingDirectory>
			<configFile>ensr_results.m</configFile>
		</resultWriter>
		<resultWriter className="org.openda.resultwriters.MatlabResultWriter">
			<workingDirectory>.</workingDirectory>
			<configFile>ensr_results.m</configFile>
		</resultWriter> -->
	</resultWriters>
</openDaApplication>
