<?xml version="1.0" encoding="UTF-8"?>
<!--Sample XML file generated by XMLSpy v2006 rel. 3 sp1 (http://www.altova.com)-->
<openDaApplication xmlns="http://www.openda.org" xmlns:xsi="http://www.w3.org/2001/XMLSchema-instance" xsi:schemaLocation="http://www.openda.org http://www.openda.org/schemas/openDaApplication.xsd">
	<stochObserver className="org.openda.costa.CtaStochObserver">
		<workingDirectory>.</workingDirectory>
		<configFile>obs_oscill.sql</configFile>
	</stochObserver>
	<stochModelFactory className="org.openda.costa.CtaStochModelFactory">
		<workingDirectory>.</workingDirectory>
		<configString>modelClass="oscill_sp_class.xml";model="oscill_sp.xml"</configString>
	</stochModelFactory>
	<algorithm className="org.openda.algorithms.kalmanFilter.EnKF">
		<workingDirectory>.</workingDirectory>
		<configString></configString>
	</algorithm>
	<resultWriter className="org.openda.utils.AsciiResultWriter">
		<workingDirectory>.</workingDirectory>
		<configFile>EnKF-results.txt</configFile>
	</resultWriter>
</openDaApplication>
