<?xml version="1.0" encoding="UTF-8"?>
<!--Sample XML file generated by XMLSpy v2006 rel. 3 sp1 (http://www.altova.com)-->
<openDaApplication xmlns="http://www.openda.org" xmlns:xsi="http://www.w3.org/2001/XMLSchema-instance" xsi:schemaLocation="http://www.openda.org http://www.openda.org/schemas/openDaApplication.xsd">
	<stochObserver className="org.openda.observers.NoosTimeSeriesStochObserver">
		<workingDirectory>./stochObserver</workingDirectory>
		<configFile>noosObservations.xml</configFile>
	</stochObserver>
	<stochModelFactory className="org.openda.blackbox.wrapper.BBStochModelFactory">
		<workingDirectory>./stochModel</workingDirectory>
		<configFile>config/d3dBbStochModelConfig_linux64_gnu.xml</configFile>
	</stochModelFactory>
	<algorithm className="org.openda.algorithms.Dud">
		<workingDirectory>./algorithm</workingDirectory>
		<configString>dudAlgorithm.xml</configString>
	</algorithm>
	<resultWriter className="org.openda.resultwriters.MatlabResultWriter">
		<workingDirectory>.</workingDirectory>
		<configFile>dud_results.m</configFile>
	</resultWriter>
</openDaApplication>
